{
  "format": "squema-circuit",
  "version": "1.0.0",
  "num_qubits": 2,
  "operations": [
    { "type": "gate", "name": "h", "targets": [0] },
    { "type": "measure", "targets": [0], "to_bits": [0] },
    { "type": "gate", "name": "x", "targets": [1], "condition": { "bit": 0, "equals": 1 } }
  ]
}


